{
  "schema_version": "0.1.0",
  "summary": "Found one requirement failure.",
  "findings": [
    {
      "candidate_id": "r2-c1",
      "title": "Invalid numeric identifiers return a server error.",
      "body": "An invalid identifier reaches int() without error handling. The resulting ValueError escapes the endpoint and returns HTTP 500 instead of the required HTTP 400.",
      "severity": "major",
      "category": "correctness",
      "relationship": "pr_related",
      "locations": [
        {
          "path": "app/views.py",
          "start_line": 21,
          "end_line": 23,
          "side": "RIGHT",
          "revision_role": "head"
        }
      ],
      "evidence": [
        {
          "kind": "code",
          "explanation": "The new endpoint converts untrusted text with int() without handling ValueError.",
          "source_ids": [
            "code-head"
          ],
          "location": {
            "path": "app/views.py",
            "start_line": 21,
            "end_line": 23,
            "side": "RIGHT",
            "revision_role": "head"
          },
          "artifact_id": null
        }
      ],
      "suggestion": null,
      "primary_location": {
        "path": "app/views.py",
        "start_line": 21,
        "end_line": 23,
        "side": "RIGHT",
        "revision_role": "head"
      },
      "rule_id": null,
      "existing_finding_id": null
    }
  ],
  "limitations": [],
  "quality_control": {
    "built_in": {
      "scope": {
        "result": "pass",
        "explanation": "No violation found in the PR changes.",
        "evidence": [],
        "candidate_ids": []
      },
      "requirements": {
        "result": "finding",
        "explanation": "Invalid identifier handling does not meet the Jira requirement.",
        "evidence": [
          {
            "kind": "requirement",
            "explanation": "Jira explicitly requires HTTP 400 for invalid numeric identifiers.",
            "source_ids": [
              "jira-description"
            ],
            "location": null,
            "artifact_id": null
          }
        ],
        "candidate_ids": [
          "r2-c1"
        ]
      },
      "previous_findings": {
        "result": "not_applicable",
        "explanation": "No prior findings were supplied.",
        "evidence": [],
        "candidate_ids": []
      },
      "english": {
        "result": "pass",
        "explanation": "No violation found in the PR changes.",
        "evidence": [],
        "candidate_ids": []
      },
      "internal_references": {
        "result": "pass",
        "explanation": "No violation found in the PR changes.",
        "evidence": [],
        "candidate_ids": []
      }
    },
    "custom_rules": [
      {
        "rule_id": "test-plan",
        "result": "pass",
        "explanation": "The PR test plan covers invalid-identifier input as required.",
        "evidence": [],
        "candidate_ids": []
      }
    ],
    "closed_finding_decisions": [],
    "import_accounting_revision": 1,
    "import_omissions": []
  }
}
