{
  "schema_version": "0.1.0",
  "summary": "One dismissed issue needs renewed verification; the unrelated fixed issue remains closed.",
  "findings": [],
  "limitations": [],
  "quality_control": {
    "built_in": {
      "scope": {
        "result": "pass",
        "explanation": "Checked current changes and requirements.",
        "evidence": [],
        "candidate_ids": []
      },
      "requirements": {
        "result": "pass",
        "explanation": "Checked current changes and requirements.",
        "evidence": [],
        "candidate_ids": []
      },
      "previous_findings": {
        "result": "pass",
        "explanation": "Checked current changes and requirements.",
        "evidence": [],
        "candidate_ids": []
      },
      "english": {
        "result": "pass",
        "explanation": "Checked current changes and requirements.",
        "evidence": [],
        "candidate_ids": []
      },
      "internal_references": {
        "result": "pass",
        "explanation": "Checked current changes and requirements.",
        "evidence": [],
        "candidate_ids": []
      }
    },
    "custom_rules": [],
    "closed_finding_decisions": [
      {
        "finding_id": "finding-11111111-1111-4111-8111-111111111111",
        "decision": "reassess",
        "reason": "The new caller removes the assumption underlying the dismissal.",
        "change_evidence": [
          {
            "kind": "code",
            "explanation": "A new caller in app/routes.py bypasses validation assumed by the dismissal; the original handler file is unchanged.",
            "source_ids": [
              "code-head"
            ],
            "location": {
              "path": "app/routes.py",
              "start_line": 10,
              "end_line": 12,
              "side": "RIGHT",
              "revision_role": "head"
            },
            "artifact_id": null
          }
        ]
      },
      {
        "finding_id": "finding-22222222-2222-4222-8222-222222222222",
        "decision": "retain_closure",
        "reason": "Only an unrelated docstring in the same file changed; the fix still applies.",
        "change_evidence": []
      }
    ],
    "import_accounting_revision": 1,
    "import_omissions": []
  }
}
